[
  {
    "session_id": "session_0129",
    "timestamp": "2026-01-02T06:20:00+00:00",
    "candidate_id": "candidate_017",
    "job_id": "job_018",
    "position": 1,
    "event_type": "impression",
    "clicked": 0,
    "relevance": 0
  },
  {
    "session_id": "session_0129",
    "timestamp": "2026-01-02T06:21:00+00:00",
    "candidate_id": "candidate_017",
    "job_id": "job_012",
    "position": 2,
    "event_type": "apply",
    "clicked": 1,
    "relevance": 3
  },
  {
    "session_id": "session_0129",
    "timestamp": "2026-01-02T06:22:00+00:00",
    "candidate_id": "candidate_017",
    "job_id": "job_010",
    "position": 3,
    "event_type": "impression",
    "clicked": 0,
    "relevance": 0
  },
  {
    "session_id": "session_0129",
    "timestamp": "2026-01-02T06:23:00+00:00",
    "candidate_id": "candidate_017",
    "job_id": "job_013",
    "position": 4,
    "event_type": "impression",
    "clicked": 0,
    "relevance": 0
  },
  {
    "session_id": "session_0129",
    "timestamp": "2026-01-02T06:24:00+00:00",
    "candidate_id": "candidate_017",
    "job_id": "job_006",
    "position": 5,
    "event_type": "impression",
    "clicked": 0,
    "relevance": 0
  },
  {
    "session_id": "session_0129",
    "timestamp": "2026-01-02T06:25:00+00:00",
    "candidate_id": "candidate_017",
    "job_id": "job_020",
    "position": 6,
    "event_type": "impression",
    "clicked": 0,
    "relevance": 0
  },
  {
    "session_id": "session_0129",
    "timestamp": "2026-01-02T06:26:00+00:00",
    "candidate_id": "candidate_017",
    "job_id": "job_007",
    "position": 7,
    "event_type": "click",
    "clicked": 1,
    "relevance": 2
  },
  {
    "session_id": "session_0129",
    "timestamp": "2026-01-02T06:27:00+00:00",
    "candidate_id": "candidate_017",
    "job_id": "job_011",
    "position": 8,
    "event_type": "impression",
    "clicked": 0,
    "relevance": 0
  },
  {
    "session_id": "session_0129",
    "timestamp": "2026-01-02T06:28:00+00:00",
    "candidate_id": "candidate_017",
    "job_id": "job_019",
    "position": 9,
    "event_type": "impression",
    "clicked": 0,
    "relevance": 0
  },
  {
    "session_id": "session_0129",
    "timestamp": "2026-01-02T06:29:00+00:00",
    "candidate_id": "candidate_017",
    "job_id": "job_002",
    "position": 10,
    "event_type": "impression",
    "clicked": 0,
    "relevance": 1
  },
  {
    "session_id": "session_0130",
    "timestamp": "2026-01-02T06:30:00+00:00",
    "candidate_id": "candidate_017",
    "job_id": "job_009",
    "position": 1,
    "event_type": "impression",
    "clicked": 0,
    "relevance": 0
  },
  {
    "session_id": "session_0130",
    "timestamp": "2026-01-02T06:31:00+00:00",
    "candidate_id": "candidate_017",
    "job_id": "job_019",
    "position": 2,
    "event_type": "impression",
    "clicked": 0,
    "relevance": 0
  },
  {
    "session_id": "session_0130",
    "timestamp": "2026-01-02T06:32:00+00:00",
    "candidate_id": "candidate_017",
    "job_id": "job_016",
    "position": 3,
    "event_type": "impression",
    "clicked": 0,
    "relevance": 0
  },
  {
    "session_id": "session_0130",
    "timestamp": "2026-01-02T06:33:00+00:00",
    "candidate_id": "candidate_017",
    "job_id": "job_010",
    "position": 4,
    "event_type": "impression",
    "clicked": 0,
    "relevance": 0
  },
  {
    "session_id": "session_0130",
    "timestamp": "2026-01-02T06:34:00+00:00",
    "candidate_id": "candidate_017",
    "job_id": "job_001",
    "position": 5,
    "event_type": "impression",
    "clicked": 0,
    "relevance": 0
  },
  {
    "session_id": "session_0130",
    "timestamp": "2026-01-02T06:35:00+00:00",
    "candidate_id": "candidate_017",
    "job_id": "job_020",
    "position": 6,
    "event_type": "impression",
    "clicked": 0,
    "relevance": 0
  },
  {
    "session_id": "session_0130",
    "timestamp": "2026-01-02T06:36:00+00:00",
    "candidate_id": "candidate_017",
    "job_id": "job_011",
    "position": 7,
    "event_type": "impression",
    "clicked": 0,
    "relevance": 0
  },
  {
    "session_id": "session_0130",
    "timestamp": "2026-01-02T06:37:00+00:00",
    "candidate_id": "candidate_017",
    "job_id": "job_002",
    "position": 8,
    "event_type": "impression",
    "clicked": 0,
    "relevance": 1
  },
  {
    "session_id": "session_0130",
    "timestamp": "2026-01-02T06:38:00+00:00",
    "candidate_id": "candidate_017",
    "job_id": "job_003",
    "position": 9,
    "event_type": "impression",
    "clicked": 0,
    "relevance": 2
  },
  {
    "session_id": "session_0130",
    "timestamp": "2026-01-02T06:39:00+00:00",
    "candidate_id": "candidate_017",
    "job_id": "job_017",
    "position": 10,
    "event_type": "click",
    "clicked": 1,
    "relevance": 3
  },
  {
    "session_id": "session_0131",
    "timestamp": "2026-01-02T06:40:00+00:00",
    "candidate_id": "candidate_017",
    "job_id": "job_007",
    "position": 1,
    "event_type": "impression",
    "clicked": 0,
    "relevance": 2
  },
  {
    "session_id": "session_0131",
    "timestamp": "2026-01-02T06:41:00+00:00",
    "candidate_id": "candidate_017",
    "job_id": "job_008",
    "position": 2,
    "event_type": "impression",
    "clicked": 0,
    "relevance": 0
  },
  {
    "session_id": "session_0131",
    "timestamp": "2026-01-02T06:42:00+00:00",
    "candidate_id": "candidate_017",
    "job_id": "job_017",
    "position": 3,
    "event_type": "apply",
    "clicked": 1,
    "relevance": 3
  },
  {
    "session_id": "session_0131",
    "timestamp": "2026-01-02T06:43:00+00:00",
    "candidate_id": "candidate_017",
    "job_id": "job_010",
    "position": 4,
    "event_type": "impression",
    "clicked": 0,
    "relevance": 0
  },
  {
    "session_id": "session_0131",
    "timestamp": "2026-01-02T06:44:00+00:00",
    "candidate_id": "candidate_017",
    "job_id": "job_013",
    "position": 5,
    "event_type": "impression",
    "clicked": 0,
    "relevance": 0
  },
  {
    "session_id": "session_0131",
    "timestamp": "2026-01-02T06:45:00+00:00",
    "candidate_id": "candidate_017",
    "job_id": "job_003",
    "position": 6,
    "event_type": "impression",
    "clicked": 0,
    "relevance": 2
  },
  {
    "session_id": "session_0131",
    "timestamp": "2026-01-02T06:46:00+00:00",
    "candidate_id": "candidate_017",
    "job_id": "job_012",
    "position": 7,
    "event_type": "click",
    "clicked": 1,
    "relevance": 3
  },
  {
    "session_id": "session_0131",
    "timestamp": "2026-01-02T06:47:00+00:00",
    "candidate_id": "candidate_017",
    "job_id": "job_018",
    "position": 8,
    "event_type": "impression",
    "clicked": 0,
    "relevance": 0
  },
  {
    "session_id": "session_0131",
    "timestamp": "2026-01-02T06:48:00+00:00",
    "candidate_id": "candidate_017",
    "job_id": "job_009",
    "position": 9,
    "event_type": "impression",
    "clicked": 0,
    "relevance": 0
  },
  {
    "session_id": "session_0131",
    "timestamp": "2026-01-02T06:49:00+00:00",
    "candidate_id": "candidate_017",
    "job_id": "job_019",
    "position": 10,
    "event_type": "impression",
    "clicked": 0,
    "relevance": 0
  },
  {
    "session_id": "session_0132",
    "timestamp": "2026-01-02T06:50:00+00:00",
    "candidate_id": "candidate_017",
    "job_id": "job_014",
    "position": 1,
    "event_type": "impression",
    "clicked": 0,
    "relevance": 0
  },
  {
    "session_id": "session_0132",
    "timestamp": "2026-01-02T06:51:00+00:00",
    "candidate_id": "candidate_017",
    "job_id": "job_019",
    "position": 2,
    "event_type": "impression",
    "clicked": 0,
    "relevance": 0
  },
  {
    "session_id": "session_0132",
    "timestamp": "2026-01-02T06:52:00+00:00",
    "candidate_id": "candidate_017",
    "job_id": "job_015",
    "position": 3,
    "event_type": "impression",
    "clicked": 0,
    "relevance": 0
  },
  {
    "session_id": "session_0132",
    "timestamp": "2026-01-02T06:53:00+00:00",
    "candidate_id": "candidate_017",
    "job_id": "job_017",
    "position": 4,
    "event_type": "impression",
    "clicked": 0,
    "relevance": 3
  },
  {
    "session_id": "session_0132",
    "timestamp": "2026-01-02T06:54:00+00:00",
    "candidate_id": "candidate_017",
    "job_id": "job_013",
    "position": 5,
    "event_type": "impression",
    "clicked": 0,
    "relevance": 0
  },
  {
    "session_id": "session_0132",
    "timestamp": "2026-01-02T06:55:00+00:00",
    "candidate_id": "candidate_017",
    "job_id": "job_002",
    "position": 6,
    "event_type": "click",
    "clicked": 1,
    "relevance": 1
  },
  {
    "session_id": "session_0132",
    "timestamp": "2026-01-02T06:56:00+00:00",
    "candidate_id": "candidate_017",
    "job_id": "job_018",
    "position": 7,
    "event_type": "impression",
    "clicked": 0,
    "relevance": 0
  },
  {
    "session_id": "session_0132",
    "timestamp": "2026-01-02T06:57:00+00:00",
    "candidate_id": "candidate_017",
    "job_id": "job_010",
    "position": 8,
    "event_type": "impression",
    "clicked": 0,
    "relevance": 0
  },
  {
    "session_id": "session_0132",
    "timestamp": "2026-01-02T06:58:00+00:00",
    "candidate_id": "candidate_017",
    "job_id": "job_007",
    "position": 9,
    "event_type": "impression",
    "clicked": 0,
    "relevance": 2
  },
  {
    "session_id": "session_0132",
    "timestamp": "2026-01-02T06:59:00+00:00",
    "candidate_id": "candidate_017",
    "job_id": "job_012",
    "position": 10,
    "event_type": "impression",
    "clicked": 0,
    "relevance": 3
  },
  {
    "session_id": "session_0133",
    "timestamp": "2026-01-02T07:00:00+00:00",
    "candidate_id": "candidate_017",
    "job_id": "job_002",
    "position": 1,
    "event_type": "impression",
    "clicked": 0,
    "relevance": 1
  },
  {
    "session_id": "session_0133",
    "timestamp": "2026-01-02T07:01:00+00:00",
    "candidate_id": "candidate_017",
    "job_id": "job_005",
    "position": 2,
    "event_type": "impression",
    "clicked": 0,